{"run":24,"commit":"8afafb6","metric":0,"metrics":{"build_seconds":0.161,"conflict_markers":0,"unmerged_files":0,"graph_refs":0,"workflow_run_id":0,"site_http":0,"blog_http":0,"graph_http":0,"blog_cards":0,"og_tests_failed":0,"candidate_dirty":1},"status":"keep","description":"Run guide index translations before slower blog translations","timestamp":1777674212518,"segment":0,"confidence":null,"asi":{"hypothesis":"The current translation workflow spends too long in blog translation before it reaches guide indexes, so running guide index translation first lets CI create /de/guides/ and /es/guides/ content before any slower blog work.","evidence":"GitHub Actions run 25235376413 remained in the Translate content step for over 10 minutes. The guide 404 fix only needs section index translations.","verification":"cd cmd/translate && go test ./... passed, hugo --quiet passed, and autoresearch.sh passed locally with deploy_failures=0."}}
{"run":25,"commit":"6b01393","metric":0,"metrics":{"build_seconds":0.175,"conflict_markers":0,"unmerged_files":0,"graph_refs":0,"workflow_run_id":25235751514,"site_http":200,"blog_http":200,"graph_http":404,"blog_cards":17,"og_tests_failed":0,"candidate_dirty":0},"status":"keep","description":"Pushed guide-first translation workflow and verified deploy","timestamp":1777674290602,"segment":0,"confidence":null,"asi":{"hypothesis":"Pushing the guide-first translation workflow should keep GitHub Pages green and cancel older in-progress translation runs through the workflow concurrency group.","verification":"autoresearch.sh pushed master, watched Deploy to GitHub Pages run 25235751514, and verified live root and blog returned 200.","next_action":"Watch the new Translate content run for HEAD 8afafb6, then verify generated guide locale pages or inspect the bot PR if auto-merge is pending."}}
{"run":26,"commit":"8153d3e","metric":0,"metrics":{"build_seconds":0.171,"conflict_markers":0,"unmerged_files":0,"graph_refs":0,"workflow_run_id":0,"site_http":0,"blog_http":0,"graph_http":0,"blog_cards":0,"og_tests_failed":0,"candidate_dirty":1},"status":"keep","description":"Trigger translation workflow when its own CI definition changes","timestamp":1777674308989,"segment":0,"confidence":null,"asi":{"hypothesis":"Changes to translate.yml should start the translation workflow so CI behavior changes can be validated immediately after push.","root_cause":"The previous guide-first workflow commit did not start a new Translate content run because on.push.paths omitted .github/workflows/translate.yml.","verification":"go test ./... in cmd/translate passed, hugo --quiet passed, and autoresearch.sh passed locally."}}
{"run":27,"commit":"baa4f9b","metric":0,"metrics":{"build_seconds":0.168,"conflict_markers":0,"unmerged_files":0,"graph_refs":0,"workflow_run_id":25235800353,"site_http":200,"blog_http":200,"graph_http":404,"blog_cards":17,"og_tests_failed":0,"candidate_dirty":0},"status":"keep","description":"Pushed translation workflow self-trigger and verified deploy","timestamp":1777674376623,"segment":0,"confidence":null,"asi":{"hypothesis":"After adding the workflow self-trigger path, pushing master should start Translate content and keep the normal Pages deploy green.","verification":"autoresearch.sh pushed master, watched Deploy to GitHub Pages run 25235800353, and verified live root/blog returned 200.","next_action":"Watch the Translate content workflow for the pushed commit, confirm it creates or merges guide index translations, then verify /de/guides/ and /es/guides/."}}
{"run":28,"commit":"876a48e","metric":0,"metrics":{"build_seconds":0.176,"conflict_markers":0,"unmerged_files":0,"graph_refs":0,"workflow_run_id":0,"site_http":0,"blog_http":0,"graph_http":0,"blog_cards":0,"og_tests_failed":0,"candidate_dirty":1},"status":"keep","description":"Bound translation HTTP timeout and retry attempts in CI","timestamp":1777675023326,"segment":0,"confidence":null,"asi":{"hypothesis":"The translation workflow is hanging in LLM HTTP calls. Configurable HTTP timeout and retry attempts let CI fail over or skip files instead of spending many minutes per field.","evidence":"Translate content run 25235800348 stayed in the Translate content step for over 10 minutes even after guide-index-only ordering.","verification":"Added tests for TRANSLATE_MAX_ATTEMPTS and TRANSLATE_HTTP_TIMEOUT_SECONDS, then verified go test ./... in cmd/translate, hugo --quiet, and autoresearch.sh locally."}}
{"run":29,"commit":"5aa51db","metric":0,"metrics":{"build_seconds":0.189,"conflict_markers":0,"unmerged_files":0,"graph_refs":0,"workflow_run_id":25236160115,"site_http":200,"blog_http":200,"graph_http":404,"blog_cards":17,"og_tests_failed":0,"candidate_dirty":0},"status":"keep","description":"Pushed bounded translation CI and verified deploy","timestamp":1777675101440,"segment":0,"confidence":null,"asi":{"hypothesis":"Pushing the bounded translation retry/timeout change will cancel the stuck translate run and start a faster bounded run while Pages remains green.","verification":"autoresearch.sh pushed master, watched Deploy to GitHub Pages run 25236160115, and verified root/blog live 200.","next_action":"Watch Translate content for commit 876a48e, then verify guide locale pages once the bot PR merges."}}
{"run":30,"commit":"a50705b","metric":0,"metrics":{"build_seconds":0.177,"conflict_markers":0,"unmerged_files":0,"graph_refs":0,"workflow_run_id":0,"site_http":0,"blog_http":0,"graph_http":0,"blog_cards":0,"og_tests_failed":0,"candidate_dirty":1},"status":"keep","description":"Add dedicated CI workflow for guide index translations","timestamp":1777675742909,"segment":0,"confidence":null,"asi":{"hypothesis":"A dedicated guide-index translation workflow will generate content/guides/_index.de.md and _index.es.md without being blocked by slower blog translation runs.","evidence":"The combined Translate content workflow still stayed in its translation step for more than 10 minutes after adding bounded attempts. A small independent workflow isolates the exact files needed to fix /de/guides/ and /es/guides/.","verification":"go test ./... in cmd/translate passed, hugo --quiet passed, and autoresearch.sh passed locally."}}
{"run":31,"commit":"4a6516f","metric":0,"metrics":{"build_seconds":0.181,"conflict_markers":0,"unmerged_files":0,"graph_refs":0,"workflow_run_id":25236500958,"site_http":200,"blog_http":200,"graph_http":404,"blog_cards":17,"og_tests_failed":0,"candidate_dirty":0},"status":"keep","description":"Pushed dedicated guide translation workflow and verified deploy","timestamp":1777675810476,"segment":0,"confidence":null,"asi":{"hypothesis":"Pushing the dedicated guide index translation workflow should start a separate Guide workflow and keep Pages deploy green.","verification":"autoresearch.sh pushed master, watched Deploy to GitHub Pages run 25236500958, and verified root/blog live 200.","next_action":"Watch or dispatch Translate guide indexes, then verify generated /de/guides/ and /es/guides/ after bot merge and deploy."}}
{"run":32,"commit":"b6196b0","metric":0,"metrics":{"build_seconds":0.166,"conflict_markers":0,"unmerged_files":0,"graph_refs":0,"workflow_run_id":0,"site_http":0,"blog_http":0,"graph_http":0,"blog_cards":0,"og_tests_failed":0,"candidate_dirty":1},"status":"keep","description":"Use direct squash merge for translation bot PRs","timestamp":1777675961437,"segment":0,"confidence":null,"asi":{"hypothesis":"Translation workflows should directly squash-merge their bot PRs because repository auto-merge is not enabled for unprotected branches.","root_cause":"Translate guide indexes created PR #163 with the expected guide files, but gh pr merge --auto failed with 'Protected branch rules not configured for this branch'.","verification":"Manually merged PR #163, then verified go test ./... in cmd/translate, hugo --quiet, and local public/de/guides/index.html plus public/es/guides/index.html exist. autoresearch.sh passed locally."}}
{"run":33,"commit":"d6f6160","metric":0,"metrics":{"build_seconds":0.167,"conflict_markers":0,"unmerged_files":0,"graph_refs":0,"workflow_run_id":25236606972,"site_http":200,"blog_http":200,"graph_http":404,"blog_cards":17,"og_tests_failed":0,"candidate_dirty":0},"status":"keep","description":"Pushed direct-merge translation workflow fix and verified deploy","timestamp":1777676032783,"segment":0,"confidence":null,"asi":{"hypothesis":"After merging guide translations and fixing bot PR merge mode, pushing master should deploy localized guide pages successfully.","verification":"autoresearch.sh pushed master, watched Deploy to GitHub Pages run 25236606972, and verified root/blog live 200.","next_action":"Wait for Pages propagation from the translation merge and direct-merge workflow fix, then curl /de/guides/ and /es/guides/."}}
{"run":34,"commit":"dd80fef","metric":0,"metrics":{"build_seconds":0.174,"conflict_markers":0,"unmerged_files":0,"graph_refs":0,"workflow_run_id":0,"site_http":0,"blog_http":0,"graph_http":0,"blog_cards":0,"og_tests_failed":0,"candidate_dirty":1},"status":"keep","description":"Make guide index translation front-matter only to avoid empty locale guide list","timestamp":1777700289835,"segment":0,"confidence":null,"asi":{"hypothesis":"The localized guide landing pages are empty because only content/guides/_index.de.md and _index.es.md exist. The child section content/guides/modern-cpp-recovery/_index.de.md and _index.es.md failed to generate because body chunk translation timed out. For the guide list, translating front matter only is sufficient to create the child section card and avoid expensive body chunk calls.","root_cause":"Translate guide indexes logs show the nested _index.md attempted six body chunks, then timed out and skipped the file. Hugo localized section lists only include localized child sections, so /de/guides/ and /es/guides/ had no .Pages to render.","verification":"Added --front-matter-only mode and configured translate-guides.yml to use it. Verified cd cmd/translate && go test ./... plus hugo --quiet and autoresearch.sh locally."}}
{"run":35,"commit":"dd80fef","metric":1,"metrics":{"build_seconds":0.175,"conflict_markers":0,"unmerged_files":0,"graph_refs":0,"workflow_run_id":0,"site_http":0,"blog_http":0,"graph_http":0,"blog_cards":0,"og_tests_failed":0,"candidate_dirty":0},"status":"discard","description":"Push rejected because remote received guide translation bot commits","timestamp":1777700305409,"segment":0,"confidence":null,"asi":{"hypothesis":"The front-matter-only guide translation change can be pushed and verified normally.","rollback_reason":"Push was rejected because origin/master advanced, likely from the guide translation workflow bot merge. The code change itself had passed local checks before commit.","next_action_hint":"Fetch and rebase onto origin/master, reapply the front-matter-only change if autoresearch reverted it, then rerun local checks and deploy verification."}}
{"run":36,"commit":"cc05520","metric":0,"metrics":{"build_seconds":0.177,"conflict_markers":0,"unmerged_files":0,"graph_refs":0,"workflow_run_id":25244955472,"site_http":200,"blog_http":200,"graph_http":404,"blog_cards":17,"og_tests_failed":0,"candidate_dirty":0},"status":"keep","description":"Rebased guide empty-list fix onto generated nested translations and verified deploy","timestamp":1777700408812,"segment":0,"confidence":null,"asi":{"hypothesis":"After rebasing onto the bot-generated nested guide translations, the localized guide landing pages should render cards locally and deploy cleanly.","verification":"hugo --quiet generated public/de/guides/index.html and public/es/guides/index.html with one essay-card each. autoresearch.sh pushed master, watched Deploy to GitHub Pages run 25244955472, and verified root/blog live 200.","root_cause":"The earlier /de/guides/ and /es/guides/ pages were not 404 anymore, but empty because only the top-level localized guides section existed. The nested modern-cpp-recovery localized section was missing after CI timed out translating its body chunks."}}
{"run":37,"commit":"a043f69","metric":0,"metrics":{"build_seconds":0.186,"conflict_markers":0,"unmerged_files":0,"graph_refs":0,"workflow_run_id":0,"site_http":0,"blog_http":0,"graph_http":0,"blog_cards":0,"og_tests_failed":0,"candidate_dirty":1},"status":"keep","description":"Render localized guide content and fallback topic cards when child translations are missing","timestamp":1777703576441,"segment":0,"confidence":null,"asi":{"hypothesis":"Localized guide pages show 0 topics because localized guide sections have fewer or no localized child pages. The templates should render section content and fall back to the default-language child pages for counts and topic cards until per-topic translations exist.","root_cause":"Top-level localized guide card used len .RegularPages on the localized child section, which is zero when localized chapter pages are missing. Nested guide sections with type guide were using layouts/_default/list.html, which did not render guide section content and did not fallback to English topic pages.","verification":"hugo --quiet generated /de/guides/ and /es/guides/ with 20 topics, and generated /de/guides/modern-cpp-recovery/ plus /es/guides/modern-cpp-recovery/ with essay-card topic lists. go test ./... in cmd/translate passed. autoresearch.sh passed locally."}}
{"run":38,"commit":"d054372","metric":0,"metrics":{"build_seconds":0.183,"conflict_markers":0,"unmerged_files":0,"graph_refs":0,"workflow_run_id":25245890701,"site_http":200,"blog_http":200,"graph_http":404,"blog_cards":17,"og_tests_failed":0,"candidate_dirty":0},"status":"keep","description":"Pushed localized guide topic fallback and verified deploy","timestamp":1777703647647,"segment":0,"confidence":null,"asi":{"hypothesis":"Pushing the guide template fallback should make localized guide pages show topic counts and topic cards after deploy.","verification":"autoresearch.sh pushed master, watched Deploy to GitHub Pages run 25245890701, and verified root/blog live 200. Local Hugo output showed /de/guides/ and /es/guides/ with 20 topics and nested guide pages with essay cards.","next_action":"Curl localized guide pages after Pages propagation to confirm live HTML includes 20 topics and topic cards."}}
{"run":39,"commit":"3c8a579","metric":0,"metrics":{"build_seconds":1.027,"conflict_markers":0,"unmerged_files":0,"graph_refs":0,"workflow_run_id":25245990234,"site_http":200,"blog_http":200,"graph_http":404,"blog_cards":17,"og_tests_failed":0,"candidate_dirty":0},"status":"keep","description":"Pushed latest guide fallback verification commit and verified GitHub Pages deploy","timestamp":1777704003652,"segment":0,"confidence":null,"asi":{"hypothesis":"The latest local verification commit should push cleanly and GitHub Pages should deploy green before live click-through testing.","verification":"autoresearch.sh pushed master, watched Deploy to GitHub Pages run 25245990234, and verified live root/blog returned 200 while removed graph stayed 404.","next_action":"Run a live crawl over nav and guide pages to simulate clicking through localized guides."}}
{"run":40,"commit":"5ff0268","metric":0,"metrics":{"build_seconds":0.515,"conflict_markers":0,"unmerged_files":0,"graph_refs":0,"workflow_run_id":0,"site_http":0,"blog_http":0,"graph_http":0,"blog_cards":0,"og_tests_failed":0,"candidate_dirty":1},"status":"keep","description":"Rewrite localized guide markdown links to published fallback topic URLs","timestamp":1777704088828,"segment":0,"confidence":null,"asi":{"hypothesis":"The live click-through failures are caused by translated guide index content preserving relative .md links, which become localized .md URLs that Hugo does not publish. Rewriting those rendered links to default-language published URLs should make all guide clicks resolve.","root_cause":"The crawler found 40 live 404s under /de/guides/modern-cpp-recovery/*.md and /es/guides/modern-cpp-recovery/*.md. These came from body content links like [Mental Model](01-modern-cpp-mental-model.md) in localized section indexes.","verification":"hugo --quiet generated localized nested guide pages with no .md hrefs and with /guides/modern-cpp-recovery/01-modern-cpp-mental-model/ fallback URLs. A local parser found zero .md links in localized guide pages. go test ./... in cmd/translate passed. autoresearch.sh passed locally."}}
{"run":43,"commit":"c7baf00","metric":0,"metrics":{"build_seconds":0.185,"conflict_markers":0,"unmerged_files":0,"graph_refs":0,"workflow_run_id":0,"site_http":0,"blog_http":0,"graph_http":0,"blog_cards":0,"og_tests_failed":0,"candidate_dirty":1},"status":"keep","description":"Replace manual Langfuse ingestion with official JS SDK","timestamp":1777716225828,"segment":0,"confidence":null,"asi":{"hypothesis":"Using the official Langfuse JS/TS SDK is more up to date and future compatible than manually posting ingestion events, while preserving the existing privacy controls and metadata shape.","verification":"Installed langfuse@latest, which npm resolves to 3.38.20 in the current registry. npm --prefix worker run typecheck passed. hugo --quiet passed. autoresearch.sh passed locally.","implementation":"sendLangfuse now creates traces and generation observations through new Langfuse(...).trace(...).generation(...), uses usageDetails instead of deprecated usage, and flushes via flushAsync/shutdownAsync in waitUntil."}}
{"run":50,"commit":"b3f5d0d","metric":0,"metrics":{"build_seconds":0.174,"conflict_markers":0,"unmerged_files":0,"graph_refs":0,"workflow_run_id":0,"site_http":0,"blog_http":0,"graph_http":0,"blog_cards":0,"og_tests_failed":0,"candidate_dirty":1},"status":"keep","description":"Use workbench photo for about and move toga image to 404","timestamp":1777723299953,"segment":0,"confidence":null,"asi":{"hypothesis":"The new workbench photo should become the main about image while the toga image can be preserved as a playful 404 Easter egg.","verification":"hugo --quiet generated homepage with /images/about-workbench.webp and 404 page with /images/404-toga-easter-egg.webp. Both generated image files exist. autoresearch.sh passed locally.","implementation":"Copied the existing square toga WebP to static/images/404-toga-easter-egg.webp, cropped the new clipboard photo to 1086x1086+220+0 and resized to 900x900 WebP at static/images/about-workbench.webp, added layouts/404.html, and added 404 image styling."}}
