{"type":"config","name":"Deploy GitHub Pages green and verify vasudev.xyz online","metricName":"deploy_failures","metricUnit":"","bestDirection":"lower"}
{"run":1,"commit":"fea85d6","metric":0,"metrics":{"build_seconds":0.12,"conflict_markers":0,"unmerged_files":0,"graph_refs":0},"status":"keep","description":"Baseline local deploy readiness after resolving merge and removing Graphify graph","timestamp":1777659418932,"segment":0,"confidence":null,"asi":{"hypothesis":"A clean Hugo build with zero conflict markers and zero Graphify page/workflow references is ready to commit before pushing to GitHub Pages.","local_checks":"hugo --minify --gc passed, no unmerged files, no conflict markers, no blocked Graphify refs."}}
{"run":2,"commit":"fea85d6","metric":1,"metrics":{"build_seconds":0,"conflict_markers":0,"unmerged_files":0,"graph_refs":0},"status":"crash","description":"Attempted custom push command while autoresearch.sh gate was active","timestamp":1777659435341,"segment":0,"confidence":null,"asi":{"hypothesis":"Push and workflow monitoring can be treated as the deployment experiment, but the harness requires the command to be routed through autoresearch.sh when it exists.","rollback_reason":"No code change to keep. The run was rejected by the autoresearch harness before executing git push.","next_action_hint":"Update autoresearch.sh to support DEPLOY_REMOTE=1 mode, then run ./autoresearch.sh via run_experiment."}}
{"run":3,"commit":"fea85d6","metric":1,"metrics":{"build_seconds":0.116,"conflict_markers":0,"unmerged_files":0,"graph_refs":0,"workflow_run_id":25223730838,"site_http":0},"status":"discard","description":"Remote deploy monitor selected a stale pre-fix workflow run","timestamp":1777659468877,"segment":0,"confidence":null,"asi":{"hypothesis":"Pushing current master then watching the latest deploy workflow should verify GitHub Pages, but the run selector must bind to the current HEAD SHA rather than any latest branch run.","rollback_reason":"The deployment check failed because it watched an older run that still contained the removed Graphify step, not because the current code failed.","next_action_hint":"Update autoresearch.sh to capture git rev-parse HEAD and select the Deploy to GitHub Pages run whose headSha matches it."}}
{"run":4,"commit":"c550d65","metric":0,"metrics":{"build_seconds":0.119,"conflict_markers":0,"unmerged_files":0,"graph_refs":0,"workflow_run_id":25226785339,"site_http":200},"status":"keep","description":"Watched current HEAD deploy workflow and verified live site HTTP 200","timestamp":1777659528660,"segment":0,"confidence":null,"asi":{"hypothesis":"Binding the workflow watcher to the current HEAD SHA avoids stale failed runs and correctly verifies the pushed deployment.","workflow_run":"25226785339 completed successfully for fea85d6.","live_site":"https://vasudev.xyz/ returned HTTP 200 after deploy."}}
{"run":5,"commit":"4fd1ba1","metric":0,"metrics":{"build_seconds":0.121,"conflict_markers":0,"unmerged_files":0,"graph_refs":0,"workflow_run_id":25226835008,"site_http":200},"status":"keep","description":"Pushed autoresearch watcher commit and verified deploy remained green","timestamp":1777659607686,"segment":0,"confidence":null,"asi":{"hypothesis":"Pushing the follow-up autoresearch watcher commit should not regress the Pages deploy or live site.","workflow_run":"25226835008 completed successfully for c550d65.","live_site":"https://vasudev.xyz/ returned HTTP 200 after the follow-up push."}}
{"run":6,"commit":"4fd1ba1","metric":0,"metrics":{"build_seconds":0.119,"conflict_markers":0,"unmerged_files":0,"graph_refs":0,"workflow_run_id":25226889617,"site_http":200},"status":"discard","description":"Confirmed current HEAD deploy run and live site still green after compaction","timestamp":1777659744191,"segment":0,"confidence":null,"asi":{"hypothesis":"After resuming, the most valuable next check is binding the current local and remote HEAD to the already-triggered Pages run and confirming the live site remains online.","rollback_reason":"Primary metric equaled the existing best of zero deploy failures, so there was no code improvement to keep.","next_action_hint":"If continuing, extend the verification surface to include /blog/ and absence of /graph/ as diagnostic checks, but do not change production code unless a remote failure appears.","workflow_run":"25226889617 is the Deploy to GitHub Pages run for current HEAD 4fd1ba1.","live_site":"https://vasudev.xyz/ returned HTTP 200."}}
{"run":7,"commit":"4fd1ba1","metric":0,"metrics":{"build_seconds":0.118,"conflict_markers":0,"unmerged_files":0,"graph_refs":0,"workflow_run_id":25226889617,"site_http":200,"blog_http":200,"graph_http":404},"status":"discard","description":"Extended verification to live blog and removed graph URL","timestamp":1777659778919,"segment":0,"confidence":null,"asi":{"hypothesis":"The next risk after home page HTTP 200 is that the blog route might not be online or the removed graph page might still be published from stale artifacts.","rollback_reason":"Primary metric stayed at the existing best of zero deploy failures. The temporary benchmark expansion confirmed diagnostics but did not improve the primary metric.","next_action_hint":"If continuing, persist the /blog/ and /graph/ diagnostics only if the user wants stronger ongoing monitoring. Production remains green without code changes.","workflow_run":"25226889617 remained successful for HEAD 4fd1ba1.","live_blog":"https://vasudev.xyz/blog/ returned HTTP 200.","removed_graph":"https://vasudev.xyz/graph/ returned HTTP 404, confirming the graph page is no longer live."}}
{"run":8,"commit":"4fd1ba1","metric":0,"metrics":{"build_seconds":0.115,"conflict_markers":0,"unmerged_files":0,"graph_refs":0,"workflow_run_id":25226974565,"site_http":200,"blog_http":200,"graph_http":404},"status":"discard","description":"Watched newest in-progress Pages run for current HEAD to completion","timestamp":1777659816954,"segment":0,"confidence":null,"asi":{"hypothesis":"A newer Pages run existed for the same HEAD after resume, so watching that run provides stronger evidence than relying on the earlier successful run.","rollback_reason":"Primary metric equaled best at zero deploy failures, so no code change should be kept.","next_action_hint":"Monitor for additional workflow_run-triggered Pages reruns from translation automation. If no new HEAD run appears, final state remains stable.","workflow_run":"25226974565 completed successfully for HEAD 4fd1ba1.","live_site":"home and blog returned 200; graph returned 404."}}
{"run":9,"commit":"4fd1ba1","metric":0,"metrics":{"build_seconds":0.127,"conflict_markers":0,"unmerged_files":0,"graph_refs":0,"workflow_run_id":25226974565,"site_http":200,"blog_http":200,"graph_http":404},"status":"discard","description":"Updated persisted autoresearch notes and reconfirmed stable deploy state","timestamp":1777659857066,"segment":0,"confidence":null,"asi":{"hypothesis":"Persisting the resume findings in autoresearch.md helps future agents avoid rechecking stale-run and graph-removal questions, while the current deploy state should remain green.","rollback_reason":"Primary metric stayed at zero deploy failures. Autoresearch files are preserved, but no production code improvement was needed.","next_action_hint":"No failing deployment signal remains. If forced to continue, poll GitHub Actions for a new current-HEAD Pages run, otherwise stop changing production code.","workflow_run":"25226974565 still successful for HEAD 4fd1ba1.","live_routes":"home 200, blog 200, graph 404."}}
{"run":10,"commit":"4fd1ba1","metric":0,"metrics":{"build_seconds":0.114,"conflict_markers":0,"unmerged_files":0,"graph_refs":0,"workflow_run_id":25226974565,"site_http":200,"blog_http":200,"graph_http":404},"status":"discard","description":"Polled current deployed HEAD and live routes after second resume","timestamp":1777659907818,"segment":0,"confidence":null,"asi":{"hypothesis":"After the second resume, the next most valuable non-invasive experiment is to poll the current HEAD deployment and live routes without changing production code.","rollback_reason":"Primary metric equaled the existing best of zero deploy failures, so there was no production improvement to keep.","next_action_hint":"All deployment signals are stable. Continue only by monitoring for a new current-HEAD Pages run or a live-route regression; avoid changing production code unless a failure appears.","workflow_run":"25226974565 remains successful for HEAD 4fd1ba1.","live_routes":"home 200, blog 200, graph 404."}}
{"run":11,"commit":"4fd1ba1","metric":1,"metrics":{"build_seconds":0.115,"conflict_markers":0,"unmerged_files":0,"graph_refs":0,"workflow_run_id":0,"site_http":0,"blog_http":0,"graph_http":0,"blog_cards":0},"status":"discard","description":"Blog-card diagnostic hit non-fast-forward remote before deploy verification","timestamp":1777659950511,"segment":0,"confidence":null,"asi":{"hypothesis":"Adding a live blog content diagnostic would verify the blog is not just HTTP 200 but actually rendering post cards.","rollback_reason":"The run failed before verification because origin/master advanced, likely from automation, so local HEAD must be synchronized before further deploy checks.","next_action_hint":"Fetch origin/master, inspect the new commit, rebase or fast-forward local master without reintroducing Graphify, then rerun ./autoresearch.sh.","error_detail":"git push rejected with non-fast-forward: remote contains work not present locally."}}
{"run":12,"commit":"fbf3036","metric":1,"metrics":{"build_seconds":0.089,"conflict_markers":0,"unmerged_files":0,"graph_refs":0,"workflow_run_id":0,"site_http":0,"blog_http":0,"graph_http":0,"blog_cards":0},"status":"discard","description":"Remote OG automation commit broke Hugo with duplicate images front matter","timestamp":1777659978831,"segment":0,"confidence":null,"asi":{"hypothesis":"After fast-forwarding to the automation commit, the deploy loop should verify the new remote HEAD, but local Hugo build catches regressions before pushing.","rollback_reason":"Hugo build failed because the OG image automation commit added duplicate images keys to blog front matter.","next_action_hint":"Deduplicate images keys in English blog front matter and inspect the OG image workflow so it does not append duplicate images on future runs.","error_detail":"content/blog/frontend-ai-agents-streaming-ui.md had duplicate images keys at front matter lines 6 and 7."}}
{"run":13,"commit":"fbf3036","metric":1,"metrics":{"build_seconds":0.121,"conflict_markers":0,"unmerged_files":0,"graph_refs":0,"workflow_run_id":0,"site_http":0,"blog_http":0,"graph_http":0,"blog_cards":0},"status":"discard","description":"Uncommitted fix could not trigger a Pages run because autoresearch pushes only commits","timestamp":1777660278721,"segment":0,"confidence":null,"asi":{"hypothesis":"Deduplicating front matter and fixing the OG generator should restore deploy green, but the experiment harness must push a commit for GitHub Actions to run.","rollback_reason":"The run failed because fixes were uncommitted, so git push had no new HEAD and no matching Pages workflow appeared.","next_action_hint":"Reapply the dedupe and generator fix, then use a keep log on a local readiness experiment or manually commit? In this harness, create a passing local run that can be kept/committed before remote verification.","error_detail":"No Deploy to GitHub Pages workflow run found after push."}}
{"run":14,"commit":"c2b72a6","metric":0,"metrics":{"build_seconds":0.173,"conflict_markers":0,"unmerged_files":0,"graph_refs":0,"og_tests_failed":0,"candidate_dirty":1,"workflow_run_id":0,"site_http":0,"blog_http":0,"graph_http":0,"blog_cards":0},"status":"keep","description":"Fix OG generator duplicate images regression and restore local deploy readiness","timestamp":1777660340456,"segment":0,"confidence":null,"asi":{"hypothesis":"The root cause is insertImageField inserting after description before seeing an existing images field later, so scanning for images first and replacing only the first occurrence prevents future duplicates while deduplicating current posts restores Hugo.","root_cause":"OG automation commit fbf3036 added duplicate images fields because insertImageField inserted after description and then also replaced the existing images field that followed description.","fix":"Deduplicated current English blog front matter, changed insertImageField to pre-detect images and drop duplicates, and added a regression test for images after description.","verification":"hugo --minify --gc passed and cd cmd/generate-og-images && go test ./... passed in autoresearch.sh local candidate mode.","next_action_hint":"Run ./autoresearch.sh again after this keep commit so it can push the committed fix and watch the matching GitHub Pages run."}}
{"run":15,"commit":"bc926a6","metric":0,"metrics":{"build_seconds":0.173,"conflict_markers":0,"unmerged_files":0,"graph_refs":0,"og_tests_failed":0,"candidate_dirty":0,"workflow_run_id":25227354022,"site_http":200,"blog_http":200,"graph_http":404,"blog_cards":17},"status":"keep","description":"Pushed OG duplicate fix and verified Pages deploy plus live blog content","timestamp":1777660420630,"segment":0,"confidence":null,"asi":{"hypothesis":"Once the duplicate-image fix is committed, the deployment loop should push it, watch the matching current-HEAD Pages run, and verify live home/blog routes plus removed graph route.","workflow_run":"25227354022 completed successfully for HEAD c2b72a6.","live_routes":"home 200, blog 200 with 17 essay cards, graph 404.","regression_guard":"cmd/generate-og-images now has a test for existing images after description so the automation should not reintroduce duplicate images keys."}}
{"run":16,"commit":"bc926a6","metric":0,"metrics":{"build_seconds":0.167,"conflict_markers":0,"unmerged_files":0,"graph_refs":0,"og_tests_failed":0,"candidate_dirty":0,"workflow_run_id":25227410920,"site_http":200,"blog_http":200,"graph_http":404,"blog_cards":17},"status":"discard","description":"Pushed final autoresearch log commit and reconfirmed deploy green","timestamp":1777660494714,"segment":0,"confidence":null,"asi":{"hypothesis":"The keep commit created by the previous successful remote verification should itself deploy cleanly when pushed.","rollback_reason":"Primary metric equaled the existing best of zero deploy failures, and no production code changed in this experiment beyond pushing the existing commit.","next_action_hint":"Watch for automation follow-up commits. If origin/master advances again, fast-forward and rerun local Hugo plus generator tests before deploying.","workflow_run":"25227410920 completed successfully for HEAD bc926a6.","live_routes":"home 200, blog 200 with 17 cards, graph 404."}}
{"run":17,"commit":"bc926a6","metric":0,"metrics":{"build_seconds":0.162,"conflict_markers":0,"unmerged_files":0,"graph_refs":0,"og_tests_failed":0,"candidate_dirty":0,"workflow_run_id":25227410920,"site_http":200,"blog_http":200,"graph_http":404,"blog_cards":17},"status":"discard","description":"Repolled latest pushed fix deployment and live content","timestamp":1777660564144,"segment":0,"confidence":null,"asi":{"hypothesis":"After pushing and verifying the duplicate-image fix, a subsequent poll should remain green while automation settles.","rollback_reason":"Primary metric remained at the best value of zero deploy failures, with no new code improvement to keep.","next_action_hint":"Check whether translate or OG automation created new master commits. If origin/master advances, fast-forward and rerun the loop to catch regressions.","workflow_run":"25227410920 still successful for HEAD bc926a6.","live_routes":"home 200, blog 200 with 17 cards, graph 404."}}
{"run":18,"commit":"5f4e105","metric":1,"metrics":{"build_seconds":0.18,"conflict_markers":0,"unmerged_files":0,"graph_refs":0,"og_tests_failed":0,"candidate_dirty":0,"workflow_run_id":0,"site_http":0,"blog_http":0,"graph_http":0,"blog_cards":0},"status":"discard","description":"Auto-merged OG PR advanced master without triggering Pages deploy","timestamp":1777660843568,"segment":0,"confidence":null,"asi":{"hypothesis":"Fast-forwarding to the bot OG image commit should have a matching Pages push run, but GitHub token automation can advance master without triggering the deploy workflow.","rollback_reason":"No matching Deploy to GitHub Pages run appeared for HEAD 5f4e105 within the wait window.","next_action_hint":"Teach autoresearch.sh to trigger deploy.yml via workflow_dispatch when no current-HEAD Pages run exists after a push/no-op push, then watch that run.","error_detail":"gh run list showed no Deploy to GitHub Pages run for 5f4e105; latest deploy remained bc926a6."}}
{"run":19,"commit":"f4766b5","metric":0,"metrics":{"build_seconds":0.171,"conflict_markers":0,"unmerged_files":0,"graph_refs":0,"og_tests_failed":0,"candidate_dirty":0,"workflow_run_id":25227809562,"site_http":200,"blog_http":200,"graph_http":404,"blog_cards":17},"status":"keep","description":"Dispatch Pages deploy when automation advances master without push run","timestamp":1777661108701,"segment":0,"confidence":null,"asi":{"hypothesis":"When bot automation advances master without triggering a push deploy, explicitly dispatching deploy.yml on master should produce a current-HEAD Pages run and publish the latest content.","workflow_run":"25227809562 workflow_dispatch completed successfully for HEAD 5f4e105.","live_routes":"home 200, blog 200 with 17 cards, graph 404 after dispatch.","fix":"autoresearch.sh now falls back to gh workflow run deploy.yml --ref master if no current-HEAD deploy run appears."}}
{"run":20,"commit":"unknown","metric":1,"metrics":{"build_seconds":0,"conflict_markers":0,"unmerged_files":0,"graph_refs":0,"workflow_run_id":0,"site_http":0,"blog_http":0,"graph_http":0,"blog_cards":0,"og_tests_failed":0,"candidate_dirty":1},"status":"crash","description":"Attempted focused i18n verification while autoresearch.sh gate was active","timestamp":1777671525547,"segment":0,"confidence":null,"asi":{"hypothesis":"A focused go test plus Hugo build command can validate the guide translation CI change.","rollback_reason":"The autoresearch harness rejected custom experiment commands because autoresearch.sh exists.","next_action_hint":"Run ./autoresearch.sh, then run focused checks with bash if needed outside autoresearch."}}
{"run":21,"commit":"dba8873","metric":0,"metrics":{"build_seconds":0.166,"conflict_markers":0,"unmerged_files":0,"graph_refs":0,"workflow_run_id":0,"site_http":0,"blog_http":0,"graph_http":0,"blog_cards":0,"og_tests_failed":0,"candidate_dirty":1},"status":"keep","description":"Extend translation CI to include recursive guides and translated guide section indexes","timestamp":1777671560097,"segment":0,"confidence":null,"asi":{"hypothesis":"The /de/guides/ and /es/guides/ 404s happen because the translation workflow only scans flat blog files and skips section _index.md pages. Recursing content/guides with _index translation lets CI generate localized guide landing pages and nested guide pages.","root_cause":"Translate workflow was scoped to content/blog/*.md and cmd/translate only read one directory level while skipping all _index.md files, so no content/guides/_index.de.md or _index.es.md could be generated.","verification":"Added failing collector tests first, then implemented recursive source discovery with an --include-index flag. Verified cd cmd/translate && go test ./... and hugo --quiet. autoresearch.sh passed with deploy_failures=0."}}
{"run":22,"commit":"b1d4fc6","metric":0,"metrics":{"build_seconds":0.169,"conflict_markers":0,"unmerged_files":0,"graph_refs":0,"workflow_run_id":25234333973,"site_http":200,"blog_http":200,"graph_http":404,"blog_cards":17,"og_tests_failed":0,"candidate_dirty":0},"status":"keep","description":"Pushed i18n CI change and verified GitHub Pages deploy stayed green","timestamp":1777671635484,"segment":0,"confidence":null,"asi":{"hypothesis":"After committing the recursive guide translation workflow update, the normal deploy should remain green and the live site should continue serving existing pages while translation CI generates guide locales separately.","verification":"autoresearch.sh pushed master, watched Deploy to GitHub Pages run 25234333973, and verified live https://vasudev.xyz/ and /blog/ returned 200 while removed /graph/ stayed 404.","note":"The translation workflow now runs for content/guides and will open/merge a bot PR with content/guides/_index.de.md and _index.es.md, which should make /de/guides/ and /es/guides/ render after that translation PR deploys."}}
{"run":23,"commit":"7fa2978","metric":0,"metrics":{"build_seconds":0.174,"conflict_markers":0,"unmerged_files":0,"graph_refs":0,"workflow_run_id":0,"site_http":0,"blog_http":0,"graph_http":0,"blog_cards":0,"og_tests_failed":0,"candidate_dirty":1},"status":"keep","description":"Limit guide translation CI to section index pages so locale landing pages unblock quickly","timestamp":1777673484762,"segment":0,"confidence":null,"asi":{"hypothesis":"The first guide translation run is slow because it attempts every guide page. Translating only guide _index.md files fixes /de/guides/ and /es/guides/ quickly while keeping blog translation unchanged.","root_cause":"The requested 404s require localized section indexes, not every nested guide chapter. Full recursive guide translation can spend too long in LLM calls before producing the landing pages.","verification":"Added an index-only collector test first, then implemented --index-only and verified go test ./... in cmd/translate plus hugo --quiet. autoresearch.sh passed locally with candidate_dirty=1 before commit."}}
